sub_indicator,iso,2015,note
q5,CI,1,"Cote d’Ivoire’s regulation is open to large and medium independent power producers (IPPs), but is not tailored to let in smaller loads. While the 2014 Electricity Act states that generation facilities used primarily for self-consumption may sell excess to the grid, the current interpretation of this article is that such agreements will be awarded on a case-by-case basis and thus primarily target large facilities linked to industrial activities.  "
q5,CL,2,
q5,CM,2,"The 2011 Electricity Law laid the foundations for liberalisation of the market. However, this will only be achieved in practice subject to operational decrees being passed."
q5,CN,2,There are no barriers to private sector participation in generation.
q5,CO,2,
q5,CR,0,"Laws 7200 of 1990 and 7508 of 1995 permit limited private sector participation in power generation: in 2014, around 15% of the country’s 2.85GW of installed generating capacity were privately owned.The law states that total private sector generation must not exceed 15% of total country generation. At least 35% of private generation companies must be owned by Costa Rican citizens."
q5,DO,2,Private companies own 90% of the installed capacity.
q5,EC,2,"Every 10 years, Arconel publishes its Master Electrification Plan (PME), which sets strategies for Ecuador's power system expansion. The plan currently in force includes a list with 36 plants (5.2GW), mostly from Celec EP, that are expected to start operation from 2013 to 2022. The private sector may apply for permits for projects that were not considered in the PME. After the submission of a feasibility study, the project will be evaluated by Arconel. If approved, a PPA is signed between it and the private company. "
q5,EG,1,"Most of the land for renewables projects is government-owned and is allocated by the New & Renewable Energy Authority. While this may be helpful, the allocation process can be lengthy, particularly if multiple agencies are involved. Overall, some administrative processes could be streamlined, the government needs to localise international standards and there is a lack of awareness about renewables among consumers."
q5,ET,0,"Economics will continue to be a challenge for grid-scale IPPs, which must compete against a cheap mostly-hydro fleet that is indirectly subsidised by the federal government. This is why, in over a decade, we have yet to see a successful IPP project completed. For an IPP to operate in Ethiopia,ET, it would need to negotiate a power purchase agreement (PPA) with EEP. There is very little precedent for this, and the regulator (the Ethiopian Energy Authority; EEA) is still deciding on the details for determining an acceptable PPA price. For the existing fleet, for example, the EEA is still deciding how to distinguish between generation, transmission, and distribution costs. The generation-only component could be a benchmark upon which EEP could consider PPAs with IPPs. Retail prices (around $30/MWh) are much too low to support any new generation technologies, let alone the fact that the generation-only benchmark is a mere fraction of this price. Thus, economics (distorted by indirect subsidisation of state-owned generation) are a tremendous challenge for IPPs. It is true that the EEA will force EEP to consider PPAs at above-market prices (Reykjavik Geothermal’s Corbetti project has received a PPA priced at $75/MWh, for example), but the incentive to buy expensive electricity from IPPs rather than indirectly subsidised energy from EEP-owned projects is minimal.  Foreign exchange is another major issue for private enterprise in Ethiopia. There is a persistent shortage of foreign exchange in the country, since the Ethiopian Central Bank’s (ECB’s) monetary policy enforces a ‘crawling peg’ between the value of the Ethiopian birr and the US dollar. Essentially, the ECB limits exchange transactions in order to artificially inflate the value of the birr, to help limit its current account (import minus export) deficit, and to control against inflation. What this means for private companies is i) it can be challenging to import equipment into the country (there is a waiting list for foreign exchange transactions), and ii) it can be challenging to transfer domestic profits to a safer, less inflation-riddled currency than the birr."
q5,GH,0,"It is very difficult to get a power purchase agreement (PPA) with the government, according to developers. There are also generation and transmission risks, as reflected in the failure of the state to honour PPAs with existing generators or new prospects (how can the state fail to honour agreements with prospective IPPs?)."
q5,GT,2,
q5,GY,1,The vast rural areas of the country are supplied by small-scale private energy companies that produce and distribute electricity for the country’s hinterland and rural villages. (Total 35MW)
q5,HN,2,76.6% of the installed capacity is from private companies.
q5,HT,1,"Although government allows private sector participation, many factors, such as lack of availability of financial investments, political instability and lack of regulations, make the generation sector unattractive to private actors. "
q5,ID,0,The largest barrier to private sector participation in the generation business is PLN's lack of willingess to act as an off-taker for power generated from renewable energy at a price above the average power production costs of PLN in the area. Utility-scale projects by independent power produers are only possible where they displace PLN's expensive diesel-fired generation.
q5,IN,2,There are no regulatory barriers to private sector participation in power generation. Independent power producers (IPPs) are a major driver of renewable energy growth.
q5,IN-AP,1,
q5,IN-BR,1,
q5,IN-MP,2,
q5,IN-OR,2,
q5,IN-UP,1,
q5,IN-WB,1,
q5,JM,2,"Jamaica already held two renewable energy auctions opened for both national and international entities. Jamaica's generation market is currently composed of five IPPs, and another two are expected to enter the market in 2016."
q5,JO,2,"Private sector participation is encouraged and incentivised where possible. There have been the introduction of tax incentives and off-taker guarantees, and the establishment of the Jordanian Investment Commission. "
q5,KE,2,The licensing process for IPPs is considered relatively simple. There are no major hurdles.
q5,LB,1,"Independent power producers are authorised by law, but it is unclear which institution is mandated to award licences. Consequently, new generation capacity from IPPs has been very limited. Historically, this situation has created a boon for retailers of diesel gensets and even, despite it being illegal, retailers of electricity produced by groups of diesel gensets. Together they are estimated to generate around 30% of the electricity consumed in Lebanon. This is creating opportunities for rooftop solar."
q5,LK,0,"The main hindrance for private companies looking to generate on-grid renewable energy is the application process itself. The key stumbling block is getting 'sign-off' from the CEB, which needs to verify grid connection. Other ministries also pose problems. New small hydro plants, for instance, need to get sign-off from the Ministry of Irrigation, while wind projects on the west coast had issues with the Ministry of Tourism. The CEB does also still control the amount of capacity that is offered to the private sector, and has kept a large chunk (100MW) of the proposed 375MW Mannar wind farm's permits for itself.   "
q5,LR,0,"The two major barriers to private sector participation in Liberia are the creditworthiness of LEC, which operates at a loss and is entirely donor-funded, and the lack of an independent energy regulator. The regulator currently resides within the Ministry of Lands, Mines and Energy and will not become fully independent until October 2017. This makes it difficult for an investor to be guaranteed a return on investment. With no regulator, an IPP risks financing a project with no guarantee that LEC can interconnect and buy all output from the project consistently. LEC's revenues have grown as its custmer base has increased, but its operating costs are growing even faster. It has had a negative net operating income for several years."
q5,MM,2,NA
q5,MW,0,"The regulation and licensing procedure can be burdensome. There are licensing fees to be paid to MERA (Malawi Energy Regulatory Authority) for application, issue and renewal. ESCOM negotiates tariffs on a single project level, which further delays the overall process. High initial investment costs, the lack of dedicated financing mechanisms and technical expertise represent additional barriers to the successful delivery of projects."
q5,MX,2,Mexico's energy reform has streamlined the process for private generators to participate in the power market. 
q5,MZ,0,The development of power generation plants in Mozambique requires a concession from the government. Projects with an output of greater than 100MVA require consessions to be approved by the Council of Ministers.
q5,NG,2,"The procedure established by the Nigerian Electricity Regulatory Commission (NERC) to become an IPP can be lengthy. The regulations are set out in detail here http://www.nercng.org/index.php/industry-operators/licensing-procedures. Section 62 of the Electric Power Sector Reform Act 2005 states that any person intending to engage in the business of electricity generation, transmission, system operation, distribution or trading must first obtain an operator's licence from NERC."
q5,NI,2,
q5,NP,1,"The national utility is to freeze new power purchase agreements (PPAs) for hydro plants, according to reports, having contracted enough additional capacity to meet its targets."
q5,PA,2,Generation companies can request grid access to be approved by the transmission regulator.
q5,PE,2,The  Ley de Concesiones Eléctricas Nº 25844 allows private participation in the generation sector. There is 48 generation companies.
q5,PK,2,"Pakistan's current focus is the addition of new power generation capacity. The government is therefore making efforts to remove bottlenecks that hinder entry of new private players to the market. Project developers have previously complained about the length of time it takes the National Electric Power Regulatory Authority to process applications. Project financing is becoming easier. For instance, State Bank of Pakistan has reduced interest rates for new projects by around 45% in recent years."
q5,PY,1,"ANDE manages generation, transmission and distribution in Paraguay. In addition, the country's economy is very much state-centred, which inhibits private sector participation. "
q5,RW,2,"IPPs are at the heart of Rwanda’s ambition to grow its generation capacity to 563MW by 2018, up from 160MW in early 2015. The government has identified capital expenditure of $1.6bn to meet this target, including $167m for hydro nationally (86MW), $206m for hydro regionally and $103m for solar PV (40MW). Another $116.5m is budgeted to facilitate the development of geothermal projects (if sufficient resources are confirmed). The majority of these contracts will be procured through tenders, which have elicited high levels of competition in the past. The small hydro feed-in tariff is currently under review and is likely to be renewed and extended to more technologies (the 2015 energy strategy includes 26MW of new hydro and 12MW of combined solar PV and bioenergy capacity). All IPPs operate on 20- to 25-year take-or-pay PPAs, which protects them, to a certain extent, from problems in other segments of the energy sector. "
q5,SL,1,"Addax's bioenergy 14MW plant is the first IPP asset to be built, but it is yet to be fully commissioned. The PPA was negotiated with NPA and the ministry. The lack of grid capacity, particulary for intermittent supply sources, is a major barrier to an IPP. It is also took a solar developer four years to obtain a PPA, albeit that this period covered a change in ministry personnel and also the ebola outbreak. Such a long development cycle will hinder many smaller IPPs."
q5,SN,2,"There are no legal or official barriers to private sector participation in generation, nevertheless the structure of energy sector governance could be simplified to better drive the government's ambitious growth targets for energy. The environment for investing in Senegal is not currently adapted to fast and easy project development. VAT for renewable energy projects is suspended during the construction phase only, and is applied once the project starts producing energy. This creates a challenge for project developers because subcontractors do not benefit from the VAT removal. Contact between project developers and stakeholders like constructors, lawyers and debt providers can be slow and difficult, especially due to the sector's complicated governance structure. The wind and solar projects currently under construction lost time in negotiations due to a lack of renewable energy expertise on the part of Senelec."
q5,SR,0,Three companies control generation in Suriname.
q5,SV,2,71.5% of national installed capacity comes from from private companies.   
q5,TJ,0,"BT operates all power plants connected to the grid. To set up a new plant an independent power producer (IPP) would have to embark on a long process that is encumbered by bureaucratic hurdles.  The process varies and is subject to case-by-case processing by the Ministry of Energy, the Taxation Committee and environmental clearances. Electricity prices are too low for investors to make a profit."
q5,TT,1,"T&TEC is responsible for the transmission, distribution and administration of electrical power for the national electrical grid of Trinidad and Tobago. Only three private players participate in the generation market."
q5,TZ,1,"Government support is required to undertake big projects. While the regulator (Ewura) has a good reputation, other parts of government are less transparent and can be harder to predict. In addition, securing land for a power plant can be an issue but not to the extent seen in other countries such as Kenya. Also, the process for securing the necessary environmental and social clearance is not transparent, causing delay."
q5,UG,1,"On the view that a number of speculators had entered the Ugandan energy sector, since 2015 the regulator has charged increasing amounts to hold site permits. Developers who fail to progress their projects may be fined and have their permits revoked. Missed deadlines can also be met by fines, but the process is not entirely transparent for developers. Additionally, due to the pipieline of projects due to be commissioned, the regulator is no longer accepting new applications for solar projects. Concerns over the ability of the transmission grid to absorb more renewables capacity may also limit prospects for developers."
q5,UY,2,
q5,VE,0,"Corpoelec, which incorporates 14 regional state-owned companies,  is the only organisation allowed to generate eletricity in Venezuela. "
q5,VN,1,"In 2014, the Ministry of Planning and Investment relaxed laws hindering foreign investment so that foreigners are now allowed to fully own assets and companies. Limitations on land ownership remain in place, but 50 to 100-year concessional leases are available instead. Despite this progress, many companies active in market refer to the cumbersome permitting process as the greatest obstacle to attracting private participation. Projects owned by EVN and its JVs get special warranties from the Ministry of Industry and Trade, guaranteeing payment on their contracts. IPPs do not recieve the same financial incentives. "
q5,ZA,0,"With Eskom as the sole buyer of electricity, a power purchase agreement must first be reached before the private sector can enter the market."
q5,ZM,1,"Securing PPAs with Zesco as a private company is notoriously difficult, a lengthy and bureaucratic process. The country's 'Scaling Solar' tenders, run by Zesco's owner, the IDC, will bypass this and should speed up the process."
q5,ZW,0,"While there is a single IPP in the country and legislation exists for independent power production exists, there has been no new uptake. over nine years. Along with a poor tariff, another barrier is that all operators are required to pay 1% of their annual revenues to the regulator. The government has recently cancelled the licences of 18 IPPs for failing to develop their projects."
q6,AR,2,Consumers cannot choose retail suppliers or enter into a third-party power market.
q6,BB,2,"Under current law, only the BLPC is allowed to sell power to the general public."
q6,BD,2,"Designated state-owned power distribution companies have a monopoly in their respective zones for retailing power. Ironically, Bangaldeshis living off-grid have more options when it comes to choosing a solar home system provider."
q6,BO,2,Consumers cannot choose retail suppliers or third-party power suppliers.
q6,BR,2,The distribution market is divided into concession areas. Consumers are not allowed to choose retail suppliers. 
q6,BS,2,Interconnection of any private generation (including solar panels) with the electricity grid is not allowed. 
q6,BW,2,BPC is the sole provider of retail energy services. There is no expectation that this will change.
q6,BZ,2,Consumers cannot choose who they buy energy from.
q6,CD,2,"No. In theory the 2014 law allows this, but in practice the fact that grids are scattered locks in customers with a specific producer."
q6,CI,2,"CIE holds a license to operate an electricity retail monopoly until 2020. Thereafter, the liberalisation provided by the 2014 Electricity Act will impose geographic and time limits on licenses. However, the government could limit the awarding of licenses to ensure that operators have a monopoly in their area in an attempt to attract more actors. Furthermore, retailing electricity outside of the grid is strictly forbidden and punishable by law, rendering mini-grid enterprises virtually impossible. A number of off-grid electricity providers are attempting to get around this by selling related services such as phone charging, internet access, refrigeration and so on."
q6,CL,2,Consumers can't choose retail suppliers or third-party power suppliers.
q6,CM,2,"There is still only one retail supplier, the integrated utility Eneo."
q6,CN,1,"Market liberalisation means some industrial consumers are able to bypass the grid and negotiate directly with generators on volume and price. This is known as the 'direct power purchase' policy. While still in the pilot phase and only intra-provincial, direct power purchase is expected to grow fast as the country is trying to liberalise its power retail segment."
q6,CO,2,Consumers can't choose retail suppliers or third-party power suppliers
q6,CR,2,There is no competition in the local power market. But there is competition with other power utilities in the region on the Regional Power Market (RPM). 
q6,DO,0,"Distributors and large end-users can buy electricity from generators under long-term contracts. There is a spot market where generators, distributors and large end-users can buy/sell the short-term energy deficit/surplus. "
q6,EC,2,"Ecuador's supply market includes CNEL, Electrica de Guayaquil and other nine small companies. All of them receive regional concessions, and consumers are limited to the companies established in their regions."
q6,EG,2,"At present, consumers have no choice over their retail suppliers, which have monopolies over geographical areas. However, under the 2015 electricity law, 'qualified' retail consumers will be able to choose from authorised suppliers, or negotiate power supply deals directly with generation companies. The law does not define 'qualified', but it seems likely to cover industrial and commercial customers. 'Non-eligible' customers will pay a regulated tariff and buy power from the distribution companies."
q6,ET,2,"EEU is the sole distributor of grid-scale power. However, there are many examples of unofficial off-grid transactions, whereby the owner of a diesel generators sell power to customers directly."
q6,GH,2,The three distribution companies all operate in different areas of the country and do not compete for customers.
q6,GT,2,There is a designated distributor for each region of the country.
q6,GY,2,GPL controls transmission and distribution. 
q6,HN,2,"On 20 May 2014, a new electricity law came into force in Honduras. The law regulates the generation, transmission, distribution and sale of electricity, as well as the operation of the national electricity system. It determined the end of ENEE's monopoly and allowed greater participation by private players in the power market.  This is a first step towards the participation of private players, but as of April 2016 no new policy had been published to regulate electricity sector activities. The CREE will be responsible for granting licences to new players and regulating the market."
q6,HT,2,Consumers can't choose retail suppliers or third-party power suppliers.
q6,ID,2,"According to legislation enacted in 2009, consumers are free to choose third-party power suppliers. However, in practice PLN has a monopoly and right-of-first-refusal, owing to its ownership of all transmission and distribution infrastructure. "
q6,IN,1,"Consumers with demand of more than 1MW (mainly medium and large-scale industrial operations) can buy power at competitive tariffs either directly from the generation companies or through third party power trading companies/power exchanges. However, such an option is not available to domestic, commercial and small industrial consumers who are limited to buying electricity from their regional electricity distribution company."
q6,IN-AP,1,
q6,IN-BR,2,
q6,IN-MP,1,
q6,IN-OR,1,
q6,IN-UP,2,
q6,IN-WB,2,
q6,JM,2,JPSCo controls transmission and distribution of electricity in Jamaica.  Consumers cannot choose third-party power suppliers.
q6,JO,2,"There are three distributors in the country, each serving a region in Jordan: Electricity Distribution Company (EDCO), Irbid District Electricity Company (Ideco) and Jordanian Electric Power Company (Jepco).  Consumers are not able to choose who they buy power from. "
q6,KE,2,"Kenya Power is the only entity holding a distribution license and offering a service across the country. PowerHive has received a distribution licence, but will only offer its services in off-grid communities. There are low barriers for consumers who install behind-the-meter generating units such as diesel or solar."
q6,LB,2,"Lebanon’s utility, Electricité du Liban (EDL), has a monopoly for transmission, distribution and retail of electricity in the country."
q6,LK,2,"All power purchase agreements (PPAs) are signed with the CEB, which is also the sole supplier. "
q6,LR,2,"LEC is responsible for all generation, transmission and distribution. All customers legally connected to the grid must therefore purchase electricity from LEC. Alternatively, people can pay a flat monthly rate (that is more expensive than the energy tariff) to an illegal IPP, which usually refers to a diesel generator in their local neighborhood. "
q6,MM,2,"The Ministry of Electricity and Energy (MOEE, formerly the Ministry of Electric Power, also called the Ministry of Electric Power and Energy) is the only significant purchaser of electricity for the grid. Off-grid power purchasers obtain electricity from other sources, but generally do not have the ability to ""choose"" a supplier. "
q6,MW,2,"ESCOM, the national utility, has a monopoly across the entire power sector, retail included. Consumers can only buy from the state-owned company. "
q6,MX,2,CFE continues to have the monopoly on distribution services.
q6,MZ,2,"Consumers can only buy electricity from EDM, with the exception of the Mozal aluminium smelter, which is part-owned by BHP Billiton and can import power directly from South African utility Eskom."
q6,NG,2,Consumers must purchase electricity from one of Nigeria's 11 electricity distribution companies (DISCOs) that are active in their region. DISCOs are privately-owned and managed.
q6,NI,0,"In Nicaragua,NI, electricity generation can be contracted through bilateral arrangements between generators and distributors and/or large consumers. The Instituto Nicaragüense de Energía (INE) regulates transmission and distribution with tariffs, while generators may compete freely in the market. "
q6,NP,2,There is no power market as such. The national utility is the only distributor and consumers do not have a choice of supplier.
q6,PA,2,"The distribution system is controlled by three companies: Empresa de Distribuicion Electrica Chiriqui (Edechi), Empresa de Distribuicion Electrica Elektra Noroeste (ENSA) and Empresa de Distribuicion Electrica Meio Oeste (Edemet). The distribution rights are divided by region, and customers cannot choose the company from which they buy power. "
q6,PE,0,"In 2013, some 56.4% of the power purchased was through the regulated market, and 43.6% through the free market. The latter consists of large end-users and generators contracting bilaterally."
q6,PK,2,"Consumers are not free to choose a power supplier. In Karachi, consumers can only buy electricity from K-Electric. Elsewhere, regional distribution companies have a complete monopoly on power supply in their respective areas. A few distributed generators supply electricity directly to industrial units, but these make up only a very small fraction of the overall power market. "
q6,PY,2,Consumers cannot choose retail suppliers or third-party power suppliers. ANDE controls 99.8% of the distribution market. The remaining share is supplied by very small companies that receive regional concessions. Consumers are limited to the companies established in their regions.
