sub_indicator,iso,2015,note
q6,RW,1,"Electricity retail is controlled by EUCL, a subsidiary of state-owned REG. However, the government is supporting establishment of mini-grids and is working on a framework that will allow them to operate commercially. Generation for direct use, whether it is for residential, commercial or industrial purposes, is authorised and supported by the government."
q6,SL,2,EDSA is the only player in distribution.
q6,SN,2,"Inside Senegal's main power system, Senelec, the national power company, is the only authorised retailer of electricity products. Inside rural electrification concessions, the concession holder is the only authorised retailer of electricity products. However, the growing market for off-grid products such as solar lanterns and solar home systems could mean that people in rural areas increasingly have a choice to retain control over their own energy production, instead of being limited to the concession holder or Senelec power tariffs. As many of these households rely on agriculture - which is dependent on unpredictable seasonal income - this option may become increasingly popular. Pay-as-you-go credit models will also help make these products more affordable."
q6,SR,2,"State-owned company Energiebedrijven Suriname (EBS) controls, energy transmission, distribution, retail and part of the generation market in Suriname. "
q6,SV,2,"Consumers can't choose retail suppliers. Distribution companies receive regional concessions, and consumers are limited to the companies established in their regions."
q6,TJ,2,"All power is distributed by BT, which is the only off-taker. "
q6,TT,2,T&TEC is the sole retailer of electricity in Trinidad and Tobago.
q6,TZ,2,"Tanesco has a monopoly over the retail market for the main national grid. For the mini-grid powered by the Mwenga hydro project, Rift Valley Energy is the licensed distributor. Under the power-sector reform roadmap, Tanzania is not due to see full retail market liberalisation until the middle of the next decade."
q6,UG,2,"Concessions are granted to different groups to operate the distribution grid and to supply customers in regions where the network has been developed. Currently, 10 companies have supply licences. Customers within those areas have no choice but to be served by the local distribution monopoly."
q6,UY,2,"Consumers must buy from UTE, the sole distribution company in the country."
q6,VE,2,"Corpoelec is a state-owned company in charge of electricity generation, transmission, distribution and retail in Venezuela."
q6,VN,2,EVN is the sole retailer and distributor. There are plans to deregulate the retail market by 2023. 
q6,ZA,2,"Consumers have no option but to deal with Eskom or their local municipality, depending on their location."
q6,ZM,2,"There are a few opportunities to buy power direct from independent power producers for people in the right areas, but it is often not a direct choice."
q6,ZW,2,"Zimbabwe Electricity Transmission and Distribution is the sole transmitter and distributor of electricity within Zimbabwe.  The legislation allows for other companies to be involved in transmission and distribution, but no private sector companies have been involved. "
q7,AR,2,"The wholesale market is not functioning, according to Cammesa."
q7,BB,2,Barbados does not have a wholesale power market.
q7,BD,2,There is no wholesale market. The Bangladesh Power Development Board operates as a single buyer.
q7,BO,0,Bolivia has a functioning wholesale power market. 
q7,BR,0,"Regulated by CCEE since 1995, when the market was opened."
q7,BS,2,Bahamas does not have a wholesale power market.
q7,BW,2,"There is no functioning competitive wholesale generation market, but Botswana is part of the Southern African Power Pool, where BPC participates on behalf of Botswana to import electricity from neighbouring countries, including South Africa and Mozambique."
q7,BZ,2,Belize does not have a wholesale power market
q7,CD,2,"No. Generators sell based on pre-agreed contracts with offtakers, not according to a wholesale market price."
q7,CI,2,"Cote d’Ivoire awards long-term “take-or-pay” contracts to IPPs. These are negotiated on a case-by-case basis and exclude fuel supply, which is provided by the state. This has allowed the country to successfully expand its fossil fuel power generating capacity and attract well-established international developers. For instance, it led to the successful negotiation of an ambitious 275MW hydro project with Chinese state-owned hydropower engineering and construction company Synohydro valued at around $500m, most of which will be covered by Chinese concessional finance. This deal is proof that the Ivoirian authorities are open to negotiations with developers of large projects. However, non-hydro renewable energy projects have failed to feature to date. The 2014 Electricity Act also provides for the establishment of a single public or private authority responsible for dispatch, opening the door for a wholesale power market. Progress towards a wholesale power market could be accelerated by the fact that new PPAs are unlikely to be awarded fuel supplies, which should increase visibility over generation costs and efficiencies. "
q7,CL,0,The wholesale generation market is operated by the Northern Interconnected System (SING) and the Central Interconnected System (SIC). 
q7,CM,2,"There is just one player, the integrated utility Eneo. The two IPPs supply power to Eneo."
q7,CN,1,"Wholesale prices are determined by the government. Although generators will be able to decide selling prices under the 'direct power purchase' mechanism, this market is small (less than 10% of national total generation)."
q7,CO,0,"The system operator and wholesale regulator is the same, XM (Compania de Expertos en Mercados), owned by Isagen."
q7,CR,2,Costa Rica does not have a wholesale power market
q7,DO,0,"A wholesale market exists for transactions between generators, distributors and large end-users."
q7,EC,0,The Mercado Electrico Mayorista in Ecuador was created in 1999 by Conelec. It is managed by Cenace. 
q7,EG,2,Egypt does not appear to have plans to implement a wholesale power market.
q7,ET,2,There are no plans for a domestic wholesale market. Ethiopia is a member of the East Africa Power Pool and there are currently large interconnection projects underway to connect the member countries. One of Ethiopia's ambitions is to become a major exporter of power within the region as the government sees it as a means of generating foreign currency. 
q7,GH,2,"All generators are required to sell to GridCo, usually under long-term PPAs. They report that GridCo has debt obligations that it cannot meet, which signifies there is some off-taker risk."
q7,GT,0,The system operator and wholesale regulator are the same: Administradora del Mercado Mayorista (AMM). The company is a non-profit organization.
q7,GY,2,Guyana does not have a wholesale power market.
q7,HN,2,Honduras does not have a wholesale power market.
q7,HT,2,Haiti does not have a wholesale power market.
q7,ID,2,"The Supreme Court is strongly adverse to the liberalisation of industries vital to Indonesian society, including the power sector. Progress towards a competitive wholesale market therefore likely to remain elusive for the foreseeable future. The power price benchmark is PLN's average cost of production."
q7,IN,0,"The Indian Energy Exchange and Power Exchange India Limited allow competitive wholesale trades. The exchanges enable large consumers (those with demand of more than 1MW) to receive competitive tariff bids from generation companies for short-, medium- and  long-term power supply."
q7,IN-AP,0,
q7,IN-BR,0,
q7,IN-MP,0,
q7,IN-OR,0,
q7,IN-UP,0,
q7,IN-WB,1,
q7,JM,2,Jamaica does not have a wholesale power market.
q7,JO,2,There is no wholesale generation market. All generated electricity is purchased by Nepco. 
q7,KE,2,Kenya Power is currently the only off-taker for all power generated in Kenya.
q7,LB,2,
q7,LK,1,"Although the CEB is by far the largest player in the generation market (67%), there is significant level of participation by private players in the renewables and oil and diesel generation sectors. The government has indicated that all future projects, including large-scale CCGT plants, will be subject to a transparent public tendering process. "
q7,LR,2,"There are no IPPs in Liberia. LEC is responsible for all generation, transmission and distribution, meaning there is no competitive power market. The 2015 energy law hopes to create a competitive wholesale market with IPPs entering the generation segment of Liberia's power system, but currently no such system exists."
q7,MM,2,NA
q7,MW,2,"There are no plans for the establishment of a domestic wholesale generation market, although Malawi is a member of the Southern African Power Pool (SAPP), whose goal is to facilitate the development of a competitive electricity market in the Southern African region."
q7,MX,1,"Mexico's wholesale market is still operating in a limited fashion, with only day-ahead market. Starting in 2017, the hour-ahead market will start operation. "
q7,MZ,2,"There is no wholesale power market. However, EDM has special tariffs in place for major customers"
q7,NG,2,"Power purchase agreements (PPAs) are negotiated and paid by the Nigerian Bulk Electricity Trader (NBET). As the market develops, it should theoretically be able to regulate itself without the need for NBET."
q7,NI,0,Nicaragua has a functioning wholesale power market.
q7,NP,2,"There is no power market as such, and all tariffs are regulated."
q7,PA,0,The wholesale generation market is operated by the company Centro Nacional de Despacho.
q7,PE,1,"Article 1 of Law 28832 allows medium-size and large customers to buy electricity in the wholesale market. But there is a lack of regulation so the market does not operate. Spot prices are effective for transactions between generators. Customers (consumidores libres) with installed capacity of more than 10MW can enter the spot market, but effectively no free customer buys energy there."
q7,PK,2,There is no wholesale power market at present.
q7,PY,2,Paraguay does not have a wholesale power market. 
q7,RW,2,"All IPPs operate on 20- to 25-year take-or-pay PPAs, which affords them some degree of protection from malfunction in other segments of the energy sector. Competition only occurs during the tendering process. "
q7,SL,2,"The only players in generation are EGTC and Addax, an IPP."
q7,SN,2,"Senelec has a monopsony until 2019 on the wholesale buying and selling of electricity. From 2019 onwards, it may become possible for individual generators like Kououne Power to sell power directly to another stakeholder. In the long run, Senegal's liberalised power generation sector and the power system integration ambitions of the Economic Community of West African States could also be drivers for the introduction of a wholesale power market. "
q7,SR,2,There isn`t a wholesale power market in Suriname.
q7,SV,0,El Salvador has a functioning wholesale market.
q7,TJ,2,A wholesale market does not exist in Tajikistan.
q7,TT,2,Trinidad & Tobago does not have a wholesale power market.
q7,TZ,2,"Like most countries in sub-Saharan Africa, Tanzania does not have a wholesale power market. The reform roadmap expects generators to participate in a wholesale market around the end of the decade."
q7,UG,2,There is no power market. UETCL is the single off-taker for all power production.
q7,UY,0,The Administración del Mercado Eléctrico (ADME) is responsible for the wholesale power market in the country.
q7,VE,2,.There isn`t a wholesale power market in Venezuela
q7,VN,2,"EVN generates or purchases all wholesale power under set contract rates. However, there is a pilot programme to test a competitive wholesale market, with plans for it to be operational by 2021. "
q7,ZA,2,Eskom is the sole buyer of power in South Africa.
q7,ZM,2,Power is either generated by Zesco or purchased from IPPs under bilateral contracts.
q7,ZW,2,"Zimbabwe Electricity Transmission and Distribution is the sole transmitter and distributor of electricity within Zimbabwe.  The legislation allows for other companies to be involved in transmission and distribution, but no private sector companies have been involved. "
q8,AR,2,"There are several different generators, both public and private. Private generators account for 75% of the installed capacity."
q8,BB,0,"Barbados Light & Power controls generation, transmission and distribution in Barbados."
q8,BD,1,"The Bangladesh Power Development Board is responsible for most generation, but there are also many smaller IPPs engaged in the market."
q8,BO,1,"Twelve companies participate in the generation market. Six public companies control 84% of Bolivia's installed capacity, and six private companies have the remainder. ESGA is the main public company and controls 16% of the national installed capacity (based on 2014 figures)."
q8,BR,2,"No, as the largest player (Eletrobras) has only 30% of the market. "
q8,BS,0,"BEC is the monopoly supplier to all of the major islands of The Bahamas with the exception of Grand Bahama Island. Self-generation is not allowed, and IPPs are permitted only in the Family Islands."
q8,BW,0,"The generation market is highly concentrated in the hands of BPC. The country's only IPP until recently operated a temporary diesel plant. However, this is expected to change with the establishment of a proper framework to support IPPs in the form of the Renewable Energy Strategy and the BERA."
q8,BZ,0,"Five companies generate electricity in the country: BEL (2%), Becol (74%), Hydro Maya (3%), BAL/Bapcol (1%) and Belcogen (20%). Additionally, 59% of the total electricity sold in the country is imported from Mexico (2014 numbers)."
q8,CD,0,"Although some private operators exist, SNEL operates practically all the installed capacity in the country. "
q8,CI,1,"Cote d’Ivoire has a diversified supply of electricity relative to the overall size of its system thanks to the opening up of the generation sector to IPPs in 1994. Long-term contracts were subsequently awarded to three private actors, which burn mostly natural gas and are now responsible for almost three-quarters of total national generation. To date, there have been just two IPPs, Azito Energy and CIPREL, plus the short-term power generation solution company Aggreko. The government is actively evaluating and developing new projects. However, progress is slow due to the case-by-case evaluation approach. "
q8,CL,2,There are several generators participating in the electricity market.
q8,CM,0,Eneo is an integrated utility and owns most of the country's generation capacity. New generation projects being developed will probaby not be managed by Eneo.
q8,CN,0,"The 'big-five' state-owned generators have more than 50% of capacity in all major sectors, including coal, hydro and wind. But for the PV sector, it is much more decentralised. "
q8,CO,2,"A total of 46 companies generate electricity in the country. EPM has the largest generation share, 21%."
q8,CR,0,ICE generates 76% of the national production (2014).
q8,DO,2,"15 companies generate electricity to the grid. Private companies only operate in generation, with government-owned companies handling transmission and distribution. "
q8,EC,1,Celec (state-owned utility) has 60% of the generation market. The remaining share is generated by 18 IPPs.
q8,EG,0,EEHC and its subsidiaries own over 90% of the generating capacity.
q8,ET,0,"EEP owns virtually all grid-scale power generation in Ethiopia. Reykjavik Geothermal is developing the Corbetti geothermal project and will become the country's first IPP. Off-grid, it is estimated that there is around 2GW of diesel power generation owned by various actors. This represents roughly one-third of the total installed capacity within the country, as of 2016. Some of this capacity is designed as grid backup and some is used in remote locations for general power supply. "
q8,GH,1,IPPs are predominately state-owned entities and currently make up just 15% of generation. 
q8,GT,2,"There are 46 generation companies in Guatemala,GT, private and state-owned."
q8,GY,0,"Guyana Power and Light (GPL) is responsible for all the centralized generation, transmission and distribution. "
q8,HN,2,76.6% of the installed capacity is from private companies.
q8,HT,1,"Most power is currently produced by independent power producers (IPPs), including Sogener, E-Power, and Haytrac. IPPs have been operating in Haiti’s electricity sector since 1996. The first to sign a contract with EDH was Interselect SA in Cap Haitïen in 1996. Outside of Port-au-Prince, Sogener signed two power purchase agreements in 2002 for a total installed capacity of 16MW: Cap Haïtien (8MW) and Artibonite (8MW). Haytrac currently operates two plants with a total installed capacity of 12MW: Petit-Goâve (6MW) and Les Cayes (6MW). Following the earthquake in 2010, E-Power entered the market with a 30MW heavy fuel oil power plant in Port-au-Prince."
q8,ID,0,"Power generation is dominated by the national utility PLN, although it is envisaged that the majority (25GW) of a new 35GW development programme should be undertaken by the private sector."
q8,IN,2,"The generation market in India is not concentrated, being made up of private players together with a number of central and state government-owned companies. "
q8,IN-AP,2,
q8,IN-BR,0,
q8,IN-MP,2,
q8,IN-OR,2,
q8,IN-UP,2,
q8,IN-WB,2,
q8,JM,2,JPSCo holds 60% of generation in Jamaica. The remaining share is in the hands of five private generators. 
q8,JO,1,"Two players (CEGCO and SEPCO) own 62% of total generation, however, the remainder of the market is split between more than seven generators. "
q8,KE,1,"There are 20 companies delivering power to the grid in Kenya. KenGen, the former monopolist, still holds almost 70% of the generation market. Its share is expected to decline to around 50% in the coming years as new capacity is added."
q8,LB,0,"Lebanon’s utility, Electricité du Liban (EDL), has a monopoly for transmission, distribution and retail of electricity in the country. On the generation side, independent power producers (IPPs) are authorised by law but it is unclear which institution is mandated to award licenses. Consequently, new generation capacity from IPPs has been very limited."
q8,LK,0,"All conventional power generation, including large hydro and coal-fired power plants, is government-owned. This capacity makes up the bulk of the CEB's 67% share of national power generation. "
q8,LR,0,LEC is the sole actor in the country's generation market.
q8,MM,0,More than 75% of the country's grid-delivered electricity is generated by government-owned plants. The remainder comes from third-party producers.
q8,MW,0,"ESCOM, the national utility, owns almost 99% of national generation capacity. Thirty IPPs signed MoUs with the government in recent months. Two of them, HE power  (41MW hydro plant) and IntraEnergy (120MW coal plant), are currently negotiating power purchase agreements (PPAs) with ESCOM. In addition, Illovo Sugar operates two captive biomass plants with a combined capacity of 19.6MW."
q8,MX,0,"Mexico is undergoing an energy reform, which will increase private participation in the generation market. Still, at this stage the market is highly concentrated in the hands of CFE, which has 76% of generation assets. "
q8,MZ,0,"The generation market is dominated by EDM, primarily through its ownership of the 415MW Cahora Bassa hydro project. The company entered into a partnership with South African company Sasol that owns a 175MW gas plant that was commissioned in 2014. Independent power producers (IPPs) account for a small percentage of the country's generation market, with much of their capacity being short-term emergency power stations owned by Aggreko."
q8,NG,1,"There are not many players in the generation sector as it was only recently privatised. More are expected soon as the country attempts to become more attractive, for instance, by holding reverse power auctions."
q8,NI,2,Nicaragua's generation sector is composed of 20 companies.
q8,NP,0,"The NEA owns and operates the large share of generation. There are several hydro IPPs, but their projects tend to be small."
q8,PA,2,"As of April 2016, there were about 42 generators in Panama,PA, of which 40 were private."
q8,PE,1,"Edegel (private), Enersur (private), Electroperu (state-owned) and Kallpa (private) own 60% of installed capacity in Peru,PE, the remaining 40% is owned by 44 other companies. (2015)"
q8,PK,2,"There are more than 20 major private power generators in Pakistan,PK, but a large proportion (46.3%) of the national total comes from the five state-owned generation companies."
q8,PY,0,"Although ANDE dominates the market, Paraguay has a law to regulate independent and self-generators of electricity."
q8,RW,2,"Rwanda had 160MW of installed capacity in 2015, all of which was developed by the national utility. However, generation is fully liberalised and the vast majority of future projects are being developed by IPPs whose contracts will be awarded competitively as the government looks to reduce the cost of electricity supply. If the government's plans fully materialise, then the state's share of installed capacity should shrink to less than one-fifth by the end of the decade."
q8,SL,0,"The only players in generation are EGTC and Addax, an IPP."
q8,SN,0,"In 2016, Senelec controlled 74% (432.9MW) of the generation market with three private actors: Kounoune Power (67.5MW of diesel), Manatali (66MW of hydro from Mali, derived from the Senegal river) and Felou (15MW of hydro from Mali). A previous 50MW fuel oil plant owned by GTI is being rehabilitated and is currently not in operation. Several sources said that GTI is being bought out by ContourGlobal LP. Over the next year, inclusion of several renewable energy independent power producers could change the generation mix considerably. Initiatives such as the IFC Scaling Solar programme could help to bring new actors into the market. A solar auction is due to be held. It will offer between 50MW to 200MW and will finance the winning bidders via equity or debt (or both) and will also validate project agreements to ensure they are bankable and ideally can be completed within 24 months from the launch date. The small size of Senegal's power system means that the concentration of the country's generation market could change rapidly if a small amount of private projects come online. In the long run, the implementation of the country's net metering law could contribute to the broadening of the generation base. "
q8,SR,0,"Energy is generated by three power producers: EBS, Suralco and Staatsolie. "
q8,SV,2,71.5% of national installed capacity comes from private companies. The generation market is composed of one public company (CEL) and 14 private firms.
q8,TJ,0,"BT runs the majority of electricity-generating assets. It does not run the hydro-electric plants Sangtuda 1 & 2, which are owned by Russian company Inter Rao, Dushanbe CHP 2, which was developed by Chinese group TBEA, and 50MW of hydro assets owned by local public-private partnership Pamir Energy."
q8,TT,2,"Electricity on Trinidad & Tobago is produced by three independent power producers: Trinity Power Ltd. (225MW), Trinidad Generation Unlimited (720MW) and Powergen (1374MW). Trinidad & Tobago Electricity Commission has only 64MW of installed capacity."
q8,TZ,1,Four major fossil-fuelled IPPs operate in the generation market. But Tanesco retains just over half of all installed electricity-generating capacity.
q8,UG,0,"83% of Uganda's generation capacity is owned by four groups. UEGCL, the state generation company, has a 42% share while Bujagali, an independently owned hydropower plant, accounts for a further 28% of capacity."
q8,UY,1,"In 2015, UTE generated 36% of the electricity in the country. The remaining amount was generated by private players."
q8,VE,0,"Corpoelec, which incorporated 14 regional state-owned companies, is the only company allowed to generate eletricity in Venezuela. "
q8,VN,0,"EVN and its JVs own 68% of generation, while two state-run companies, PetroVietnam and Vinacomin, own 12% and 5% respectively. IPPs generate 16%. "
q8,ZA,0,"Eskom generates over 90% of South Africa's power, but that is in the process of changing as independent power producers increase their market share in renewables, gas and coal power generation."
q8,ZM,0,Zesco controls the majority of generation in the country.
q8,ZW,0,"Zimbabwe Power Corporation has a major market share, while four IPPs make up the remainder. "
q9,AR,2,"Argentina has 23 provinces, each of which has its own distribution utility. Edenor, Edesur and Edelap are the three main distributors in Argentina covering 75% of the Buenos Aires area. "
q9,BB,0,"Barbados Light & Power controls generation, transmission and distribution in Barbados."
q9,BD,0,Designated state-owned power distribution companies have a monopoly in their respective zones for retailing power.
q9,BO,1,The Bolivian supply market is in the hands of eight companies.
q9,BR,2,The largest player (AES) has only 12% of the market.
q9,BS,0,"BEC is the monopoly supplier to all of the major islands of The Bahamas with the exception of Grand Bahama Island. Self-generation is not allowed, and IPPs are permitted only on the Family Islands."
q9,BW,0,Power distribution is under full control of the BPC and there is no expectation that this will change soon.
q9,BZ,0,BEL controls transmission and distribution.
q9,CD,0,"Although some private suppliers exist, SNEL is also dominant in supply."
q9,CI,0,"CIE has a license to run an electricity supply monopoly until 2020. Thereafter, the liberalisation introduced by the 2014 Electricity Act will see new time- and geography-specific supply licenses awarded. The price at which power is sold to suppliers will continue to be regulated."
