sub_indicator,iso,2015,note
q1,AR,0,"Generation, transmission and distribution are independent in Argentina under the law 24.065. Among utilities, Pampa Holding is a vertically-integrated company, acting in the three sectors; Endesa acts in the generation sector and owns Edesur; AES acts in the generation sector and owns Edelap. However, no utility monopolises the country's power market. "
q1,BB,2,"Light & Power Holdings is an investment company with electricity as its core business. It owns the Barbados Light & Power which controls generation, transmission and distribution of electricity in Barbados.The company has been serving electricity customers in Barbados since 1911. Electricity service is available to the entire island community."
q1,BD,1,"Generation, transmission and distribution is undertaken by separate companies, most of which are state-owned. The Bangladesh Power Development Board, a part of the Ministry of Power, Energy and Mineral Resources, oversees the sector and is the single buyer. It also operates a number of mainly urban distribution networks and most of the country's generation. Transmission is carried out by the monopoly state-owned Power Grid Company."
q1,BO,0,"The country’s power sector is mostly served by recently nationalized companies responsible for generation, transmission and distribution."
q1,BR,0,"In 1995, Brazil conducted a power sector reform, which required all power companies to have separate businesses for generation, transmission and distribution. It also opened the market to private companies. Before 1995, state-owned company Eletrobras had a market monopoly"
q1,BS,2,"Two companies monopolise the power sector in Bahamas. The Bahamas Electricity Company controls generation, transmission and distribution in Bahamas and Grand Bahamas (private company) controls generation, transmission and distribution in Grand Bahamas island."
q1,BW,2,"There are no plans to unbundle the value chain, although IPPs at the generation level are being encouraged.  "
q1,BZ,1,"There are at least five different generators, but Belize Electricity Limited (BEL) is the only buyer, distributor and transmission company in Belize."
q1,CD,2,"The 2014 electricity sector law provides for unbundling by opening up different parts of the value chain to private participation. Effectively however, national utility SNEL still remains the dominant player, combining generation, transmission, distribution and sales. Also, practically, unbundling is difficult given the fragmented nature of the country's power system. This means that often the role of generator and distributor is handled by the same company."
q1,CI,1,"Cote d’Ivoire’s power sector was fully unbundled by the Electricity Act of 2014. However, the private company CIE, in which the government has a 15% stake, is licensed to operate the country’s transmission grid and as the sole distributor and retailer of electricity until 2020. Thereafter, the government will still have a monopoly in power dispatch, but may choose to license a private operator to take on these responsibilities. Generation has been fully liberalised since 1994 and private developers already own twice as much generation capacity as the government, which limits itself to hydro assets.    "
q1,CL,0,"Chile's electricity sector has been unbundled, leaving distinct actors in generation, transmission and distribution."
q1,CM,1,"Eneo Cameroon (the new name for AES-Sonel following its acquisition by Actis, a private equity investor) is an integrated utility. There are two independent power producers (IPPs) - Kribi Power Development Corporation (KPDC) and Dibamba Power Development Corporation (DPDC) - which were acquired in 2014 by Globeleq, which is controlled by Actis. The 2011 Electricity Law paves the way for unbundling and creation of a publicly-owned transmission company. The law was also designed to attract additional private investment in generation."
q1,CN,1,"The power sector in China is still essentially a monopsony (a market in which there are many generators, but only one buyer). There are several giant state-owned enterprises in the generation segment, as well as many smaller private players, particularly in the renewable sector. Monopoly grid companies have traditionally controlled transmission, distribution and retail. However, as of 2016, the private sector is allowed to invest in distribution grids and participate in the retail market."
q1,CO,0,"The electricity sector in Colombia has different private and state-owned players for all four sectors (generation, transmission, distribution and retail). There is also a large number of players in the off-grid area. EPM (Empresas Publicas Medellin) is one of the largest players, participating in the entire power market of Colombia."
q1,CR,1,"The power market in Costa Rica is regulated under the law 7593 of Aresep. It is regulated and dominated by the vertically integrated Instituto Costarricense de Electricidad (ICE), which is the major generator  of Costa Rica and the sole power purchaser in the country. According to its law, ICE is responsible for national energy demand. The Costa Rican market includes private players, in the form of cooperatives involved with generation and distribution in parts of the country and as independent power producers, selling electricity to ICE. "
q1,DO,0,"The Organismo Coordinador del Sistema Elétrico Nacional Interconectado (OC-SENI) was created in 1998 to coordinate the electricity generation, transmission and distribution companies. There is no vertically-integrated monopoly utility in Dominican Republic,DO, and the power sector is unbundled."
q1,EC,0,"Ecuador's power market is controlled by state-owned utility Corporación Eléctrica del Ecuador (Celec), responsible for transmission and most of the generation. CELEC is not involved in the distribution sector, where the main players are CNEL, Electrica de Guayaquil and other nine regional companies."
q1,EG,1,"Egypt has formally unbundled the former vertically integrated Egyptian Electricity Authority. But in practice, the power sector remains principally in the hands of the state-owned Egyptian Electricity Holding Company (EEHC), or rather its six subsidiaries for power generation, the Egyptian Electricity Transmission Company (EETC), and its nine subsidiaries for electricity distribution and retail. Private-sector participation has been allowed through three build-own-operate-transfer (BOOT) contracts and some other very small IPPs. But, the electricity law issued in June 2015 will transform the current market set-up into a competitive one based on bilateral contracts plus a regulated market. An independent transmission system operator will be created and unbundled from the other participants."
q1,ET,1,"Technically, the sector has been partially unbundled, but it continues (for the time being) to operate under a vertically-integrated entity. One could argue that the Ethiopian market is effectively still bundled. In December 2013, the government initiated a split-up of the vertically-integrated Ethiopian Electric Power Corporation (EEPCo) into Ethiopian Electric Power (EEP), which controls transmission and generation – currently it operates all grid-scale plants in the country – and Ethiopian Electric Services (EES), which is in charge of retail sales and distribution. Both are state-owned and, as of June 2016, are still governed by the same board of representatives."
q1,GH,1,"Prior to 2008, the government-owned Volta River Authority (VRA) was wholly responsible for electricity generation, transmission and distribution throughout Ghana. Under reforms begun in 2005, the VRA was restricted to power generation, while the Ghana Grid Company (GridCo) took over transmission. Distribution is carried out by state-owned companies, the Northern Electricity Department (NEDco) and the Electricity Company of Ghana (ECG). The government has interests in four independent power producers (IPPs)."
q1,GT,0,"All the segments have distinct actors, especially in generation where more than 80% of the players are independent power producers."
q1,GY,1,"Guyana’s electricity market is controlled by the state-owned Guyana Power and Light (GPL), a vertically integrated company responsible for electricity distribution, transmission and part of generation. The country’s market also includes independent power producers, which must sell electricity to GPL. "
q1,HN,1,"On 20 May 2014, a new electricity law came into force in Honduras. The law regulates the generation, transmission, distribution and sale of electricity in Honduras,HN, as well as the operation of the national electricity system. It determined the end of ENEE's monopoly and allowed greater participation of private players in the power market.  The is a first step for participation of private players. However as of June 2016, besides an electricity tariffs increase, no new policy had been published to regulate electricity sector activities. The CREE will be responsible for granting licences to new players and regulating the market."
q1,HT,1,"Electricité d'Haiti (EdH) is the country's utility company responsible for part of Haiti's electric power generation, transmission, and retail distribution. According to The Haiti Sustainable Energy Roadmap, ""although EDH has its own generation park and technically holds a monopoly over the country's electricity system, most power is currently produced by independent power producers, including Sogener, E-Power, and Haytrac. IPPs have been operating in Haiti's electricity sector since 1996. The first to sign a contract with EDH was Interselect SA in Cap Haitïen in 1996. Outside of Port-au-Prince, Sogener signed two power purchase agreements in 2002 for a total installed capacity of 16MW: Cap Haïtien (8MW) and Artibonite (8MW). Haytrac currently operates two plants with a total installed capacity of 12MW: Petit-Goâve (6MW) and Les Cayes (6MW). Following the earthquake in 2010, E-Power entered the market with a 30MW heavy fuel oil diesel power plant in Port-au-Prince."" "
q1,ID,2,"The Indonesian power sector is dominated by the vertically-integrated state-owned utility PLN and its regional subsidiaries. Independent power producers (IPPs) and suppliers are legally able to operate, but apart from some activity by a small number of generators such as Supreme Energy, the majority of the value chain is still bundled.  "
q1,IN,0,"PGCIL is a central government-owned company that operates five regional electricity grids and solely handles inter-state electricity transmission in India. Within the states, different private, state and central government-owned entities exist for the purpose of distribution and generation of power. "
q1,IN-AP,1,
q1,IN-BR,1,
q1,IN-MP,0,
q1,IN-OR,1,
q1,IN-UP,1,
q1,IN-WB,0,
q1,JM,1,"Private utility Jamaica Public Service (JPS) is in charge of 60% of generation, and 100% of transmission and distribution services in the island. Other players may enter the market as independent power producers and sell electricity to JPS. JPS is owned by Japan-based Marubeni Corporation at 40%; South-Korea-based Korea East-West Power at 40%; the Government of Jamaica at 19.9%; and some 3,000 shareholders holding the remaining 0.1% of the shares. Five companies generate electricity to the grid, but JPS is the only buyer.  "
q1,JO,0,"Distinct actors exist for different phases of energy production/transmission and distribution. There are a number of generators, but a monopsony exists where there is only one buyer. National Electric Power Company (Nepco), the single bulk buyer of energy from the generators, is in charge of transmission. Distribution is then handled by three companies, each serving a region in Jordan: Electricity Distribution Company (EDCO), Irbid District Electricity Company (Ideco) and Jordanian Electric Power Company (Jepco). "
q1,KE,2,"Kenya has 20 licensed independent power producers (IPPs) feeding power into the grid. Of these, KenGen is by far the largest, contributing more than two-thirds of total consumed electricity. Kenya Power owns and operates most transmission lines, while Ketraco has been licensed to develop new lines. Kenya Power is the only distributor of power, with the single exception of PowerHive, a mini-grid operator that received the country's first private distribution license."
q1,LB,2,"Lebanon’s utility, Electricité du Liban (EDL), has a monopoly for transmission, distribution and retail of electricity in the country. On the generation side, independent power producers are authorised by law but it is unclear which institution is mandated to award licenses. Consequently, new generation capacity from IPPs has been very limited."
q1,LK,1,CEB is owned by the government and has a monopoly in the transmission and distribution of power. It is also the country's single largest power generator. 
q1,LR,2,"The 2015 Energy Law is designed to unbundle the country's generation and distribution segments, but no distinct actors have entered the market yet. Procedures and by-laws to enable full unbundling to take place still need to be created. Theoretically, the generation and distribution segments of Liberia's power sector are liberalised as private players can enter the market and work with the independent energy regulator to arrange optimal PPAs. However, the Liberian Electricity Corporation remains the only active player in the country's generation, transmission, distribution and retail segments."
q1,MM,0,"he generation segment includes government-controlled entities and independent power producers (IPPs). The transmission segment is state-controlled. There are three main distributors, all government-controlled, which serve the Yangon and Mandalay regions and the grid-connected areas outside of those regions."
q1,MW,2,"The power sector is vertically integrated. ESCOM, the national utility, provides all on-grid generation, transmission, distribution and retail. The unbundling of generation and transmission was announced in 2015 and expected to be completed by December 2016. A new state company, Malawi Generation Co, will be responsible for generation, while ESCOM will continue to control the transmission and distribution segments."
q1,MX,1,"One of the main changes introduced by Mexico's energy reform is the separation of state-owned vertically integrated utility Comisión Federal de Electricidad (CFE), which holds the vast majority of generation assets and has monopoly over transmission and distribution. In January 2016, Mexico's Ministry of Energy (Sener) issued the decree that guides CFE's unbundling and creates different companies for generation, transmission and distribution. CFE's business separation is still ongoing. "
q1,MZ,1,"EDM is the sole actor in the transmission, distribution and retail markets, and dominates the generation market. There are independent power producers."
q1,NG,0,"The only part of the power sector that has not been fully privatised is transmission. The Transmission Company of Nigeria (TCN) was managed by Manitoba Hydro, a canadian company, but is now being managed by TCN staff who were trained by Manitoba Hydro."
q1,NI,0,Nicaragua's power sector is unbundled and distinct actors participate in the generation and distribution sectors.
q1,NP,2,"The national utility Nepal Electricity Authority (NEA) has a monopoly on transmission and distribution, and dominates generation too. However, the number of independent power producers (IPPs) involved in hydro generation is increasing."
q1,PA,0,"Panama's electricity sector has been unbundled, having distinct actors in generation, transmission and distribution."
q1,PE,0,"There are several generation, transmission and distribution companies in Peru. Generation, transmission and distribution are both legally and practically separated. In the early 1990s, the Peruvian power sector was unbundled, opened to private sector investment, and regulatory models were established for each segment. "
q1,PK,0,"There are a number of state- and privately-owned companies in generation, transmission and distribution. There is a vertically integrated private sector company that handles all three - generation, transmission and distribution - in and around Karachi. In the rest of the country, there are different actors for generation, transmission and distribution. There have been independent power producers (IPPs) in the generation sector historically, and the government plans to introduce private players to the transmission and distribution sector. While some private players now have distribution and transmission licences, most of power is purchased directly by the National Transmission Despatch Company Limited (NTDC). "
q1,PY,2,"Administración Nacional de Electricidad (ANDE) manages generation, transmission and distribution. The same organization also determines retail prices. "
q1,RW,1,"State-owned REG was incorporated in 2014 (Law 97/2013). One subsidiary, the Energy Development Corporation, focuses on transmission and development of new generation capacity (either by itself or by tendering with IPPs), while another, the Energy Utility Corporation, operates existing assets, manages retail and is power off-taker for IPPs. Generation is fully liberalised and the large majority of projects are being developed by IPPs."
q1,SL,1,"The National Electricity Act, 2011 established the unbundling of the state-owned integrated utility (Sierra Leone's National Power Authority) into: (i) the Electricity Generation and Transmission Company (EGTC); and (ii) the Electricity Distribution and Supply Authority (EDSA). This became effective in 2015. "
q1,SN,1,"Senelec, Senegal's national power company, continues to control transmission, distribution and retail of electricity in the country, apart from in rural electrification concessions where concession holders handle retail and distribution. Senelec has a monopscony until 2019 on the wholesale buying and selling of electricity. From 2019 onwards it may be possible for individual generators like Kououne Power to sell power directly to another stakeholder, depending on what happens in future legislation. Energy generation on the central grid system comes primarily from thermal power stations - Bel-Air and Cap-des-Biches, located close to Dakar, and the Kahone diesel power stations located in Kaolack, as well as from a hydro-electric dam located in Mali. In 2016, Senelec controls 74% (432.9MW) of the generation market with three private actors: Kounoune Power (67.5MW of diesel), Manatali (66MW of hydro from Mali, derived from the Senegal river) and Felou (15MW of hydro from Mali). The market share of independent power producers will increase in coming years as new solar and wind projects come online. 50 megawatts worth of solar PV projects are currently under construction and will connect to the grid at the by latest Q1 2017, and another 70MW worth have agreed contracts with Senelec. A 150MW wind project also has a contract signed and is awaiting financial close. Renewable energy development is seen as an important tool to meet energy deficiencies and contribute to reduction of poverty. The country benefits from 3,000 hours of solar irradiation on average per year, and an average wind strength of 5 meters per second. New conventional power projects: A new 125MW coal power station will come online in January 2018 on the Sendou site, developed by Conseil Economique et Social Sénégal (CES), with another 125MW expected to be added in January 2020. It is being financed by the African Development Bank (AfDB), a local bank and SMO - a Netherlands fund. Power will be sold to Senelec. Senegal has also recently discovered gas reserves off the Saint Louis coast, estimated at 450bn cubic meters, which is expected to be available from 2022. In expectation of this, new power stations are being built with capacity to operate both fuel and gas (once it becomes available). A new 52MW diesel power station at Cap des Biches is also expected to be operational from June 2016, developed by US company Contour Global, with a 30MW extention expected for January 2017. Senelec has also signed a contract with Tobene Power to build a 70MW diesel power station to be located at Taiba NDIAYE, with a 35MW extension forecast for January 2017."
q1,SR,1,"Suriname’s electricity market is controlled by state-owned Energiebedrijven Suriname (EBS), a vertically-integrated utility that controls transmission, distribution and 41% of the country’s generation capacity. Most of the remaining share is generated by the state-owned oil company, Staatsolie, and a private mining company, Suralco. According to IDB, EBS operates seven isolated systems in Suriname,SR, serving over 145,000 customers. The Energie Voorziening Paramaribo (EPAR) is the largest of EBS’s power systems, serving over 129,000 customers in the Paramaribo and surrounding areas. EBS shares its responsibility for rural electrification with the Dienst Electrificatie Voorziening (DEV), the Ministry of Natural Resource’s department of rural energy, which operates a total of 6.2MW small power systems in isolated and remote communities where EBS networks do not reach customers."
q1,SV,0,"In 1999, the Ley General de Electricidad unbundled and restructured the Comisión Ejecutiva Hidroeléctrica del Río Lempa (CEL), separating generation, transmission and distribution assets. CEL stayed only at the generation level, with competition open to private players, Etesal was created to be in charge of transmission, and distribution was open to private competition."
q1,TJ,2,"BT, the state-owned power utility, handles generation, transmisson and distribution."
q1,TT,1,"Trinidad and Tobago electricity market is controlled by the state-owned Trinidad and Tobago Electricity Commission (T&TEC), the sole transmission and distribution company in the island. It buys electricity from independent power producers."
q1,TZ,1,"State-owned and vertically integrated Tanesco continues to dominate the power sector, holding a monopoly over transmission and an oligopoly (with Mwenga Hydropower) over distribution and retail. In principle, the generation market comprises eight companies, but in practice Tanesco has more than half of the generating capacity in Tanzania. "
q1,UG,0,"The Ugandan Electricity Board was unbundled into separate entities for generation, transmission and supply through the 1999 Electricity Act, which also saw the creation of the Electricity Regulatory Authority. UMEME, a privately owned company, was granted a 20 year supply concession by the state owned Uganda Electricity Distribution Company. New sections of the distribution grid are granted under concession to UMEME or one of the other regional suppliers depending on location. Uganda is one of the few sub-Saharan countries with an unbundled power sector."
q1,UY,1,"Uruguay's electricity sector is a monopsony, where there are many generators (including private and public companies), but one vertically-integrated utility company, known as Administracion Nacional de Usinas y Trasmisiones Electricas (UTE), controls part of the generation market, and 100% of transmission and distribution."
q1,VE,2,"According to the presidential decree 5330 from July 2007, Corpoelec is a state-owned company in charge of electricity generation, transmission, distribution and retail in Venezuela. Corpoelec originated from a fusion of 14 regional state-owned companies. "
q1,VN,1,"EVN and two other state-controlled companies, Vinacomin and PetroVietnam,VN, control 78% of all generation. Independent power producers (IPPs) provide around 16% of generation, mostly in the form of large coal-fired power projects. Private companies are engaged in the sector via the build-operate-transfer model, whereby the asset is operated by the IPP for a period of time, but eventually reverts to EVN. A competitive wholesale market is being piloted, with the aim of being operational by 2021. There are also plans for a competitive retail market by 2023. "
q1,ZA,2,"Eskom, the national utility, is responsible for the majority of power generation in South Africa,ZA, with a fleet of coal power stations. Independent power producers have started to capture market share, mostly by adding renewable power assets to the grid. There are plans in place to add privately-owned coal and gas generation capacity in the coming years."
q1,ZM,0,"The state utility, Zesco, has operations in generation, transmission, distribution and retail, and controls the majority of electricity in these areas. There are a few companies that provide independent generation and retail. Sector liberalisation in the 1990s meant that it would be legally possible for a private company to run transmission or distribution networks. The Copperbelt Energy Corporation is one example, running a transmission grid in the north of the country (see the Zambia Energy Regulation Act)."
q1,ZW,2,"While the utility has been split up into two enterprises, Zimbabwe Power Corp and Zimbabwe Electricity Transmission and Distribution, they are still government-owned and run by ZESA Holdings."
q2,AR,0,There are private companies and government-owned companies in each segment.
q2,BB,2,"Barbados Light & Power controls generation, transmission and distribution in Barbados. Light & Power Holdings Ltd. is an investment company with electricity being its core business. The Company has a wholly owned regulated electric utility, The Barbados L"
q2,BD,1,"State-owned companies control most of Bangladesh's power market. Independent power producers (IPPs) are involved in power generation, accounting for nearly half of capacity, but a large proportion of that is short-term emergency rental plants."
